{
  "$schema": "../../schemas/asset-task-manifest.schema.json",
  "screenId": "BattleSceneNonHUD",
  "sourceFamilyMap": "BattleSceneNonHUD",
  "generatedAt": "2026-04-08T07:32:45.880Z",
  "taskCount": 4,
  "tasks": [
    {
      "taskId": "battle-scene-non-hud-type-badge-underlay",
      "screenId": "BattleSceneNonHUD",
      "model": "nano-banana-2",
      "zone": "tiger-tally-panel",
      "slot": "typeBadgeUnderlay",
      "taskType": "generate-partial-asset",
      "label": "F7 TigerTally type badge underlay",
      "family": "battle-card-rail",
      "recipe": "tactical-diorama-v1",
      "structureOwner": "tiger-tally-screen + UITemplateResolver",
      "skinOwner": "UISkinResolver",
      "contentOwner": "TigerTallyPanel",
      "widgetRefs": [
        "card-rail",
        "tally-card"
      ],
      "templateRefs": [],
      "targetStyle": "battle-card-rail / tactical-diorama-v1",
      "mustKeep": [],
      "mustAvoid": [],
      "fitRules": {
        "maxVisualOccupancy": 0.65,
        "runtimeIntrusionForbidden": true
      },
      "postProcess": {
        "trimByBackground": true,
        "spriteType": "sliced",
        "border": [10, 10, 10, 10]
      },
      "output": {
        "preferredMime": "image/png",
        "targetLongEdge": 512,
        "transparentBackgroundPreferred": true,
        "outputName": "battle-unit-type_badge_underlay"
      }
    },
    {
      "taskId": "battle-scene-non-hud-type-icon-glyph",
      "screenId": "BattleSceneNonHUD",
      "model": "nano-banana-2",
      "zone": "unit-info-panel",
      "slot": "typeIconGlyph",
      "taskType": "generate-partial-asset",
      "label": "F7 UnitInfo type icon glyph mother",
      "family": "dark-metal-drawer",
      "recipe": "dark-metal-v1",
      "structureOwner": "unit-info-panel-screen + UITemplateResolver",
      "skinOwner": "UISkinResolver",
      "contentOwner": "UnitInfoPanel",
      "widgetRefs": [
        "detail-drawer"
      ],
      "templateRefs": [],
      "targetStyle": "dark-metal-drawer / dark-metal-v1",
      "mustKeep": [],
      "mustAvoid": [],
      "fitRules": {
        "maxVisualOccupancy": 0.65,
        "runtimeIntrusionForbidden": true
      },
      "postProcess": {
        "trimByBackground": true,
        "spriteType": "simple"
      },
      "output": {
        "preferredMime": "image/png",
        "targetLongEdge": 512,
        "transparentBackgroundPreferred": true,
        "outputName": "battle-unitinfo_type_glyph"
      }
    },
    {
      "taskId": "battle-scene-non-hud-control-glyph-suite",
      "screenId": "BattleSceneNonHUD",
      "model": "nano-banana-2",
      "zone": "battle-log-rail",
      "slot": "controlGlyphSuite",
      "taskType": "generate-partial-asset",
      "label": "F8 BattleLog control glyph mother",
      "family": "parchment-rail",
      "recipe": "parchment-v1",
      "structureOwner": "battle-log-screen + UITemplateResolver",
      "skinOwner": "UISkinResolver",
      "contentOwner": "BattleLogPanel",
      "widgetRefs": [
        "list-panel",
        "control-chip"
      ],
      "templateRefs": [],
      "targetStyle": "parchment-rail / parchment-v1",
      "mustKeep": [],
      "mustAvoid": [],
      "fitRules": {
        "maxVisualOccupancy": 0.65,
        "runtimeIntrusionForbidden": true
      },
      "postProcess": {
        "trimByBackground": true,
        "spriteType": "simple"
      },
      "output": {
        "preferredMime": "image/png",
        "targetLongEdge": 512,
        "transparentBackgroundPreferred": true,
        "outputName": "battle-log_control_glyph"
      }
    },
    {
      "taskId": "battle-scene-non-hud-command-glyph-suite",
      "screenId": "BattleSceneNonHUD",
      "model": "nano-banana-2",
      "zone": "action-command-cluster",
      "slot": "commandGlyphSuite",
      "taskType": "generate-partial-asset",
      "label": "F8 ActionCommand glyph mother",
      "family": "gold-cta-cluster",
      "recipe": "gold-cta-v1",
      "structureOwner": "action-command-screen + UITemplateResolver",
      "skinOwner": "UISkinResolver",
      "contentOwner": "ActionCommandPanel",
      "widgetRefs": [
        "cta-stack",
        "sp-ring"
      ],
      "templateRefs": [],
      "targetStyle": "gold-cta-cluster / gold-cta-v1",
      "mustKeep": [],
      "mustAvoid": [],
      "fitRules": {
        "maxVisualOccupancy": 0.65,
        "runtimeIntrusionForbidden": true
      },
      "postProcess": {
        "trimByBackground": true,
        "spriteType": "simple"
      },
      "output": {
        "preferredMime": "image/png",
        "targetLongEdge": 512,
        "transparentBackgroundPreferred": true,
        "outputName": "battle-action_command_glyph"
      }
    }
  ],
  "warnings": []
}
