{
  "$schema": "../../schemas/asset-task-manifest.schema.json",
  "screenId": "shop-main-screen",
  "sourceFamilyMap": "shop-main-screen",
  "generatedAt": "2026-04-15T15:24:52.105Z",
  "taskCount": 0,
  "tasks": [],
  "warnings": [
    "Auto-generated skeleton: no partial asset tasks were inferred from recipe slots; fill tasks manually if this screen needs asset generation."
  ]
}
